{
  "schema_version": "1.0",
  "stage": "candidate",
  "generated_utc": "2026-09-03T17:20:00Z",
  "source_artifact": "pipeline/data/claim_graph.json",
  "hypotheses": [
    {
      "id": "H-001",
      "statement": "In advanced NSCLC receiving first-line systemic therapy, STK11 loss-of-function is associated with shorter overall survival to a similar degree in immune-checkpoint-inhibitor-containing regimens and in platinum-doublet regimens without an ICI, i.e. the treatment-by-STK11 interaction on overall survival is null and the marker is prognostic rather than predictive.",
      "origin": {
        "gap_type": "contradiction",
        "supporting_claims": [
          "C-003",
          "C-011",
          "C-012",
          "C-013",
          "C-037",
          "C-038",
          "C-039",
          "C-049"
        ],
        "rationale": "This is the central declared direct contradiction in the graph (C-003 vs C-013) and the one the whole field turns on. The resistance claim rests almost entirely on single-arm, ICI-only cohorts (C-003, C-039, C-040) which cannot separate prognosis from prediction. Every design in the graph that carries a non-ICI control arm points the other way: Papillon-Cavanagh's interaction HR is 1.05 (p=0.785) for PFS and 1.13 (p=0.540) for OS (C-012, C-013); Shire reports HR 1.4 for STK11 on first-line chemotherapy with no ICI (C-037) and the same point estimate, nonsignificant, on first-line ICI (C-038); KEYNOTE-042 randomization shows a numerically LARGER pembrolizumab benefit in STK11-mutants (C-018). I expect the data to favour C-012/C-013/C-037 over C-003/C-039. The mapper found no verified post-2022 cohort with n>500 reporting a formal treatment-by-STK11 interaction test, and my own searches did not find one either; that exact design is the gap. A large clinicogenomic cohort with both ICI-treated and chemotherapy-only first-line patients is uniquely able to supply it.",
        "prior_negative_evidence": [
          {
            "identifier": "PMID 32312757 (Papillon-Cavanagh, ESMO Open 2020)",
            "summary": "Looked directly and found nothing: no interaction between STK11 mutation and anti-PD-1/PD-L1 treatment on real-world PFS (HR 1.05, 0.76-1.44, p=0.785) or OS (HR 1.13, 0.76-1.67, p=0.540). This is the strongest existing null and it substantially discounts novelty; the remaining gap is that it is a 2020 non-squamous-only cohort with 574 ICI-treated patients, underpowered for subgroup interaction and predating chemo-immunotherapy as the dominant first-line standard.",
            "n": 2276
          },
          {
            "identifier": "J Clin Oncol 43 (16_suppl) e20504, ASCO 2025 abstract",
            "summary": "Meta-analysis of six randomized and one retrospective comparative study: chemo-immunotherapy retained an OS benefit over chemotherapy alone despite STK11 mutation (HR 0.80, 0.67-0.97), KEAP1 (0.76, 0.59-0.98) and KRAS (0.67, 0.55-0.82). A randomized-comparator null for the predictive interpretation. Conference abstract only, not a full paper.",
            "n": 1596
          },
          {
            "identifier": "PMID 34500370",
            "summary": "Commentary/analysis explicitly titled 'STK11/LKB1 and KEAP1 mutations in non-small cell lung cancer: Prognostic rather than predictive?' \u2014 the prognostic interpretation is already in print, so the novelty here is the formal interaction estimate at modern scale, not the idea.",
            "n": null
          }
        ]
      },
      "exposure": {
        "description": "STK11 loss-of-function alteration in the sequenced tumour",
        "genomic_criteria": "STK11 nonsense, frameshift, splice-site, or homozygous deletion, or a missense variant annotated oncogenic/likely-oncogenic; excludes variants of unknown significance",
        "treatment_criteria": "first-line systemic therapy containing an anti-PD-1 or anti-PD-L1 agent (with or without platinum doublet)"
      },
      "comparator": {
        "description": "Two explicit contrasts crossed in one model: (a) STK11 wild-type patients receiving the same first-line ICI-containing regimen, and (b) STK11 loss-of-function patients receiving first-line platinum-doublet chemotherapy with no ICI. The estimand is the ratio of the STK11 effect across the two treatment strata."
      },
      "population": {
        "description": "Adults with advanced or metastatic NSCLC who received first-line systemic therapy and had tumour next-generation sequencing covering STK11",
        "oncotree_codes": [
          "NSCLC",
          "LUAD",
          "LUSC"
        ],
        "inclusion": [
          "stage IIIB-IV or recurrent disease at start of first-line therapy",
          "tumour NGS panel covering STK11, KRAS, KEAP1, TP53"
        ],
        "exclusion": [
          "activating EGFR mutation or ALK/ROS1 fusion",
          "no systemic therapy recorded"
        ]
      },
      "proposed_endpoint_concept": "overall survival from start of first-line systemic therapy",
      "proposed_covariates": [
        "age at start of first-line therapy",
        "sex",
        "smoking status and pack-year burden",
        "ECOG performance status at treatment start",
        "PD-L1 tumour proportion score band",
        "histology (adenocarcinoma vs squamous vs other)",
        "KRAS, KEAP1, TP53 and SMARCA4 co-mutation status",
        "tumour mutational burden",
        "year of treatment initiation (era effects in ICI availability)",
        "time from advanced diagnosis to sequencing report, with left truncation at the sequencing date to remove immortal time between diagnosis and genomic ascertainment"
      ],
      "status": "active"
    },
    {
      "id": "H-002",
      "statement": "In advanced non-squamous NSCLC treated with first-line ICI-containing therapy, KEAP1 loss-of-function rather than STK11 loss-of-function carries the survival signal: in a model containing both genes, the KEAP1 term remains associated with shorter overall survival while the STK11 term attenuates towards the null relative to its unadjusted estimate.",
      "origin": {
        "gap_type": "contradiction",
        "supporting_claims": [
          "C-014",
          "C-024",
          "C-026",
          "C-047",
          "C-048",
          "C-049"
        ],
        "rationale": "The graph disagrees about which of the two co-occurring genes is doing the work. In the Japanese C-CAT cohort KEAP1 was significantly detrimental (HR 1.89, 1.18-3.03, p=0.008) while STK11 was not (C-024 vs C-023). De Giglio reports the opposite ordering, with STK11 surviving adjustment for KEAP1 (C-026). Papillon-Cavanagh finds neither interacts with treatment (C-012, C-014). The two genes co-occur often enough that most published STK11 estimates are partly KEAP1 estimates, and almost no cohort in the graph is large enough to hold one constant while estimating the other. I expect KEAP1 to dominate, because the NRF2-activated state it produces confers broad cytoprotection and chemo/radio-resistance that acts on survival through a treatment-independent route, whereas the STK11 signal in the graph repeatedly evaporates when a non-ICI arm or a KRAS-wildtype stratum is introduced. This is a mutual-adjustment question a large cohort answers well and a trial subgroup analysis answers badly.",
        "prior_negative_evidence": [
          {
            "identifier": "medRxiv 10.64898/2026.01.09.26343779 (PIONeeR)",
            "summary": "Prospective multicentre biomarker cohort in which NEITHER gene predicted primary resistance: STK11 OR 1.17 (0.634-2.17, p-adj 0.896), KEAP1 OR 0.663 (0.344-1.28, p-adj 0.58). A double null that weakens the premise that either gene carries a large ICI-specific signal. Preprint, not peer reviewed, second-line-plus population.",
            "n": 305
          },
          {
            "identifier": "PMID 39709652 (De Giglio, Lung Cancer 2025)",
            "summary": "Already performed the mutual adjustment in the opposite direction and found STK11 detrimental to OS after adjusting for KRAS, TP53, KEAP1 and SMARCA4 (multivariable HR 1.97, p=0.025). Directly contradicts the direction I predict; recorded here so the prediction is scored against the strongest opposing prior result rather than a straw man. Single-centre, n=145.",
            "n": 145
          },
          {
            "identifier": "PMID 32312757 (Papillon-Cavanagh, ESMO Open 2020)",
            "summary": "No KEAP1-by-treatment interaction on rwPFS (HR 0.93, 0.67-1.28, p=0.653) or OS (HR 0.98, 0.66-1.45, p=0.913) \u2014 so if KEAP1 carries the signal it is also prognostic, not predictive.",
            "n": 574
          }
        ]
      },
      "exposure": {
        "description": "KEAP1 loss-of-function alteration, estimated jointly with STK11 loss-of-function in the same model",
        "genomic_criteria": "KEAP1 nonsense, frameshift, splice-site, homozygous deletion, or oncogenic/likely-oncogenic missense; STK11 defined identically and entered as a separate term with a KEAP1 x STK11 product term",
        "treatment_criteria": "first-line anti-PD-1/PD-L1 monotherapy or chemo-immunotherapy"
      },
      "comparator": {
        "description": "Patients wild-type for both KEAP1 and STK11 receiving the same first-line ICI-containing regimen; the single-mutant strata (KEAP1-only, STK11-only) are the two contrasts of interest against that common reference."
      },
      "population": {
        "description": "Adults with advanced non-squamous NSCLC on first-line ICI-containing therapy with panel sequencing covering both STK11 and KEAP1",
        "oncotree_codes": [
          "NSCLC",
          "LUAD"
        ],
        "inclusion": [
          "panel covers STK11 and KEAP1 with adequate coverage for both"
        ],
        "exclusion": [
          "EGFR-activating mutation or ALK/ROS1 fusion",
          "squamous histology (handled separately; see stage_notes)"
        ]
      },